{
  "schemaVersion": "1.0.0",
  "pluginId": "ass-spec",
  "pluginVersion": "1.0.0",
  "platformApiVersion": "1.0.0",
  "registration": "ass_spec:registration",
  "manifest": "src/ass_spec/manifest.json",
  "scopeSchema": "src/ass_spec/scope.schema.json",
  "runtimeSource": "src",
  "semanticReview": "semantic-review.md",
  "fixtures": ["fixtures/spec-smoke.json"],
  "packageMetadata": "pyproject.toml",
  "conformance": { "contractVersion": "1.0.0" }
}
